#CODE;ENGLISH;FRENCH;GERMAN;;SPANISH;;;;;;;;;x
EVTDESC_TOG_3202;A faint whisper draws your attention and you find a haggard old crone in a dark corner of your longhouse. Before you have a chance to throw her out, she explains that she is a vŲlva Ė a seeress. She claims to be powerful in the ways of sejdr, and she has come to offer you her services.;Un faible chuchotement attire votre attention et vous apercevez dans un coin sombre de votre maison longue une vieille femme hagarde. Avant que vous n'ayez eu l'opportunitť de l'expulser, elle vous explique qu'elle est une vŲlva, une voyante. Elle vous assure que ses pouvoirs de sejdr pourraient bien vous servir.;Ein leises FlŁstern lenkt Eure Aufmerksamkeit auf sich und Ihr findet ein ausgezehrtes, altes Weib in einer dunklen Ecke Eures Langhauses. Bevor Ihr sie hinauswerft, erklšrt sie, dass sie eine VŲlva - eine Seherin - ist. Sie behauptet, stark zu sein in den Pfaden des Seiūr, und entbietet Euch ihre Dienste.;;Un leve susurro te llama la atenciůn y te encuentras con una vieja bruja demacrada en un rincůn oscuro de la casa comunal. Antes de poder echarla, te explica que es una vŲlva, una vidente. Afirma ser poderosa en las formas de sejdr, y ha venido a ofrecerte sus servicios.;;;;;;;;;x
EVTOPTA_TOG_3202;So be it. You may stay.;Soit. Vous pouvez rester.;So sei es. Sie kann bleiben.;;AsŪ serŠ. Debes quedarte.;;;;;;;;;x
EVTOPTB_TOG_3202;Be gone, witch!;Va-t-en, sorciŤre†!;Verschwinde, Hexe!;;°LŠrgate, bruja!;;;;;;;;;x
EVTDESC_TOG_3205;You are spending some time with [FromFrom.GetFirstName], who is carrying your unborn child, when [From.GetFirstName], your vŲlva seeress, bursts screaming into your bedchamber. The child is a demon, she wails. I have seen it! You are about to unleash a great evil upon the world!;Vous passez du temps avec [FromFrom.GetFirstName], qui est enceinte, quand [From.GetFirstName], votre voyante vŲlva, fait irruption dans votre chambre ŗ coucher en criant ę†Cet enfant est un dťmon, je l'ai vu†! Le monde entier souffrira de ce grand mal que vous provoquerez†!†Ľ;Ihr verbringt gerade Zeit mit [FromFrom.GetFirstName], die Euer ungeborenes Kind unterm Herzen tršgt, als [From.GetFirstName], Eure VŲlva-Seherin, schreiend hereinstŁrmt. "Das Kind ist ein Dšmon", ruft sie. "Ich habe es gesehen! Ihr werdet ein groŖes ‹bel in die Welt entlassen!";;EstŠs pasando algķn tiempo con [FromFrom.GetFirstName], que lleva a tu hijo en el vientre, cuando [From.GetFirstName], la vidente vŲlva, entra gritando en tu dormitorio. El niŮo es un demonio, se lamenta. °Lo he visto! °EstŠs a punto de desatar un gran mal en el mundo!;;;;;;;;;x
EVTOPTA_TOG_3205;Guards, remove the witch!;Gardes, sortez cette sorciŤre†!;Wachen, entfernt die Hexe!;;°Guardias, llevaos a la bruja!;;;;;;;;;x
EVTOPTB_TOG_3205;Could... could it be so? Is the child cursed?;Se... se peut-il que cet enfant soit maudit†?;KŲnnte... kŲnnte es wahr sein? Ist das Kind verflucht?;;ŅPodrŪaÖ podrŪa ser? ŅEstŠ maldito el niŮo?;;;;;;;;;x
EVTDESC_TOG_3211;It is the dead of night when a sudden chill comes upon you. You open your eyes and sit up only to see [From.GetFirstName] standing at the foot of your bed staring at you in complete silence. After rubbing the sleep out of your eyes, you look again and now there is no sign of the child.;Au beau milieu de la nuit, un frisson vous envahit soudain. Vous ouvrez les yeux et vous redressez pour dťcouvrir [From.GetFirstName], debout au pied de votre lit qui vous regarde fixement dans un silence complet. Vous frottez vos yeux encore embrumťs puis plus rien, l'enfant a disparu.;Mitten in der Nacht frŲstelt es Euch plŲtzlich. Ihr Ųffnet die Augen und setzt Euch auf, nur um [From.GetFirstName] am FuŖ Eures Bettes zu sehen, Euch still anstarrend. Nachdem Ihr Euch den Schlaf aus den Augen gerieben habt, schaut Ihr erneut hin, doch nun gibt es kein Zeichen von dem Kind.;;Es totalmente de noche, cuando sientes un repentino escalofrŪo. Abres los ojos y te sientas sůlo para ver a [From.GetFirstName] al pie de tu cama mirŠndote en completo silencio. Te frotas los ojos para quitarte el sueŮo, vuelves a mirar y no hay ni rastro del niŮo.;;;;;;;;;x
EVTOPTA_TOG_3211;Was it a dream?;Ai-je rÍvť†?;War das ein Traum ?;;ŅFue un sueŮo?;;;;;;;;;x
EVTDESC_TOG_3213;[From.GetFirstName] is sitting on the floor, playing with [From.GetHerHis] toys when something dark suddenly seems to come over the child. While spasming wildly, [From.GetFirstName] cries out in a tongue foreign to you and [From.GetHerHis] eyes roll back inside [From.GetHerHis] head.;[From.GetFirstName] est assis[From.Get_E] au sol, jouant avec ses jouets, quand une sombre chose semble soudainement l'envahir. Secouť[From.Get_E] de spasmes, [From.GetFirstName] crie dans une langue qui vous est ťtrangŤre et ses yeux se rťvulsent.;[From.GetFirstName] sitzt auf dem Boden und spielt mit [From.GetHerHis]en Spielsachen, als plŲtzlich etwas Dunkles Łber das Kind kommt. Wild zuckend schreit [From.GetFirstName] in fremden Zungen, mit nach hinten gerollten Augen.;;[From.GetFirstName] estŠ sentado en el suelo, jugando con [From.GetHerHis] juguetes cuando algo oscuro parece sucederle al niŮo. Mientras tiene violentos espasmos, [From.GetFirstName] grita en un idioma extranjero  y [From.GetHerHis] ojos ruedan hacia dentro de [From.GetHerHis] cabeza.;;;;;;;;;x
EVTOPTA_TOG_3213;That can't be a good sign...;C'est de bien mauvais augure...;Das kann kein gutes Zeichen sein...;;Eso no puede ser una buena seŮalÖ;;;;;;;;;x
EVTDESC_TOG_3215;An inhuman wail interrupts your sleep, and you hurry outside with your axe. On the ground in front of the longhouse you find [From.GetFirstName] running around in circles upside down on all fours like a spider.;Un cri inhumain vous rťveille et vous vous ruez ŗ l'extťrieur, la hache ŗ la main. Vous apercevez [From.GetFirstName], la tÍte ŗ l'envers, courant ŗ quatre pattes comme une araignťe, en faisant de grands cercles devant la maison longue.;Ein unmenschlicher Schrei unterbricht Euren Schlaf und mit Eurer Axt eilt Ihr nach drauŖen. Auf dem Boden vor dem Langhaus findet Ihr [From.GetFirstName] im Kreis rennend vor, gleich einer Spinne auf allen Vieren laufend.;;Un aullido inhumano interrumpe tu sueŮo, y sales afuera apresuradamente con tu hacha. En el suelo frente a la casa comunal encuentras a [From.GetFirstName] corriendo en cŪrculos arriba y abajo a cuatro patas como una araŮa.;;;;;;;;;x
EVTOPTA_TOG_3215;[This.Religion.GetRandomGodNameCap] help me...;Que [This.Religion.GetRandomGodName] me vienne en aide...;[This.Religion.GetRandomGodNameCap] hilf mir...;;[This.Religion.GetRandomGodNameCap] ayķdameÖ;;;;;;;;;x
child_acts_strange;[From.GetFirstName]'s behavior concerns you sometimes.;Le comportement de [From.GetFirstName] vous inquiŤte parfois.;Manchmal bereitet Euch [From.GetFirstName]s Verhalten Sorgen.;;La conducta de [From.GetFirstName] a veces te preocupa.;;;;;;;;;x
exorcism_approved;You approve the exorcism.;Vous approuvez l'exorcisme.;Ihr erlaubt den Exorzismus.;;Apruebas el exorcismo.;;;;;;;;;x
exorcism_denied;You refuse the exorcism.;Vous refusez l'exorcisme.;Ihr verbietet den Exorzismus.;;Rechazas el exorcismo.;;;;;;;;;x
exorcism_begins;You pace back and forth.;Vous faites les cent pas.;Ihr kŲnnt Euch nicht entscheiden.;;Vas de un lado a otro.;;;;;;;;;x
begone_witch;You send the wretched creature away.;Vous faites sortir cette misťrable crťature.;Ihr schickt die elende Kreatur fort.;;Echas a la criatura miserable.;;;;;;;;;x
away_witch;Your men haul the woman outside and throw her into a nearby pile of refuse.;Vos hommes traÓnent la femme ŗ l'extťrieur et la jettent sur un tas de dťtritus.;Eure Mšnner bringen die Frau nach drauŖen und werfen sie in einen Haufen Abfall.;;Tus hombres acarrean a la mujer afuera y la echan en un montůn de basura cercano.;;;;;;;;;x
no_witch;You issue clear instructions not to permit the witch within a stone's throw of your longhouse.;Vous donnez l'ordre ferme de ne pas laisser la sorciŤre s'approcher ŗ moins d'un jet de pierre de la maison longue.;Ihr gebt klare Befehle, dass sich die Hexe nicht auf einen Steinwurf Eurem Langhaus nšhern darf.;;Das instrucciones claras de no permitir a la bruja que se acerque a mŠs de un tiro de piedra de la casa comunal.;;;;;;;;;x
title_volva;Court VŲlva;VŲlva de la Cour;HofvŲlva;;VŲlva de la corte;;;;;;;;;x
title_volva_desc;A vŲlva is regarded as a powerful seeress that practises sejdr, a form of sorcery. Among other things, she deals with curses, premonitions and omens of things to come.;Une vŲlva est une puissante voyante qui pratique le sejdr, une forme de sorcellerie. Elle est spťcialiste des malťdictions, des prťmonitions et des prťsages.;Eine VŲlva ist eine mšchtige Seherin, die Seiūr praktiziert, eine Form der Zauberei. Unter anderem beherrscht sie FlŁche und das Deuten von Omen.;;Una vŲlva se considera como una poderosa vidente que practica sejdr, una forma de brujerŪa. Entre otras cosas, se ocupa de las maldiciones, presagios y augurios de lo que vendrŠ.;;;;;;;;;x
CONFIRM_DISBAND_EVTSWN;\nßRAll special event troops will be disbanded!ß!;\nToutes les unitťs crťťes par un ťvťnement seront dissoutes.;\nAlle durch das Ereignis erzeugten Truppen werden aufgelŲst.;;\nToda actividad de las tropas generadas renunciarŠ.;;;;;;;;;x
CONFIFM_DISBAND_NO_EVTSWN;\nNo special event troops will be disbanded.;\nAucune unitť crťťe par un ťvťnement ne sera dissoute.;\nKeine durch das Ereignis erzeugten Truppen werden aufgelŲst.;;\nNinguna actividad de tropa generada serŠ disuelta.;;;;;;;;;x
EVTDESC_TOG_3252;[From.GetTitledName] ambushes you as you leave your longhouse and speaks to you in a pleading voice. [FromFrom.GetFirstName] must be purged of the evil [FromFrom.GetSheHe] carries within [FromFrom.GetHerHim]. There is no other way. I can perform a galdr ritual, but I won't lie - the child may or may not survive the ordeal. Nevertheless, the demon must be vanquished.;[From.Get_Le_TitledName] se met en travers de votre chemin alors que vous quittez votre maison longue et vous demande d'une voix plaintive†: 'Il faut purger [FromFrom.GetFirstName] du mal qu'[FromFrom.GetIlElle] porte en [FromFrom.GetLuiElle]. Nous n'avons pas d'autre choix. Je peux cťlťbrer un rituel galdr, mais je dois vous dire la vťritť†: l'enfant peut ne pas survivre ŗ cette ťpreuve. Le dťmon doit Ítre vaincu.';[From.GetTitledName] Łberrascht Euch, als Ihr gerade Euer Langhaus verlasst und spricht mit flehender Stimme: "[FromFrom.GetFirstName] muss von dem BŲsen befreit werden, das in dem Kind lauert. Es gibt keinen anderen Weg! Ich kann das Galdr-Ritual durchfŁhren, doch ich werde nicht lŁgen: Das Kind wird den Ritus vielleicht nicht Łberleben. Dennoch - der Dšmon muss vernichtet werden!";;[From.GetTitledName] te tiende una emboscada cuando sales de la casa comunal y te habla con una voz suplicante. [FromFrom.GetFirstName] debe ser purgado del mal que [FromFrom.GetSheHe] lleva en [FromFrom.GetHerHim]. No hay otra manera. Puedo realizar un ritual galdr, pero no te voy a mentir, el niŮo puede o no sobrevivir a la terrible experiencia. Sin embargo, el demonio serŠ vencido.;;;;;;;;;x
EVTOPTA_TOG_3252;Perform the ritual.;Lancez le rituel.;FŁhrt das Ritual durch.;;Realizar el ritual.;;;;;;;;;x
EVTOPTB_TOG_3252;If you so much as touch [FromFrom.GetFirstName]...;Si vous osez toucher ŗ [FromFrom.GetFirstName]...;Wehe, wenn Ihr [FromFrom.GetFirstName] auch nur anrŁhrt...;;Si se te ocurre tocar a [FromFrom.GetFirstName]...;;;;;;;;;x
EVTDESC_TOG_3253;The galdr ritual to cleanse your spawn of evil has begun. The child is brought to a raised platform in a grove where [FromFrom.GetFirstName] awaits surrounded by chanting maidens. You are not permitted to witness the sacred ritual itself, so you depart the grove and wait.;Le rituel galdr pour purifier votre progťniture de son mal commence. On emmŤne l'enfant dans un bosquet sur une plateforme surťlevťe. Lŗ, [FromFrom.GetFirstName] l'attend, entourťe de jeunes filles qui chantent. Vous ne pouvez assister ŗ ce rituel sacrť, vous quittez donc le bosquet et attendez.;Das Galdr-Ritual, um Euer Kind vom BŲsen zu befreien, hat begonnen. Es wird zu einer Plattform in einem Hain gefŁhrt, wo [FromFrom.GetFirstName] umgeben von singenden Mšdchen wartet. Es ist nicht erlaubt, dass Ihr das heilige Ritual beobachtet, also verlasst Ihr den Wald und wartet. ;;El ritual galdr para limpiar a tu engendro del mal ha comenzado. El niŮo es llevado a una plataforma elevada en un bosque donde [FromFrom.GetFirstName] espera rodeado de doncellas cantando. Tķ no estŠs autorizado a presenciar el ritual sagrado, por lo que sales del bosque y esperas.;;;;;;;;;x
EVTOPTA_TOG_3253;[This.Religion.GetRandomGodNameCap] preserve us.;Que [This.Religion.GetRandomGodName] nous prťserve.;[This.Religion.GetRandomGodNameCap] rette uns!;;[This.Religion.GetRandomGodNameCap] protťgenos.;;;;;;;;;x
EVTDESC_TOG_3256;The incantations from the grove suddenly stop, and several maidens, their white gowns red with someone else's blood, run past screaming. Fearing the worst you hurry back, but when you reach the platform you find only the butchered remains of [From.GetFirstName]... and [FromFrom.GetFirstName] standing smiling next to them.;Les incantations qui proviennent du bosquet s'arrÍtent soudainement et plusieurs jeunes filles, la robe blanche maculťe du sang d'un autre, en sortent en hurlant. Craignant le pire, vous accourez ŗ la plateforme oý vous ne trouvez que des restes dťchiquetťs de [From.GetFirstName]... et [FromFrom.GetFirstName] tout sourire juste ŗ cŰtť.;Die Gesšnge aus dem Hain hŲren plŲtzlich auf und einige der Mšdchen, ihre weiŖen Kleider rot von fremden Blut, rennen schreiend davon. Das Schlimmste befŁrchtend eilt Ihr zurŁck, doch als Ihr die Plattform erreicht, findet Ihr nur die zerfleischten ‹berreste von [From.GetFirstName]... und [FromFrom.GetFirstName] steht lšchelnd daneben.;;Los encantamientos de la arboleda paran de repente, y varias doncellas, con sus togas blancas de color rojo con la sangre de otra persona, pasan corriendo gritando. Temiendo lo peor te das prisa en regresar, pero al llegar a la plataforma sůlo encuentras los restos descuartizados de [From.GetFirstName]... y [FromFrom.GetFirstName] sonriendo a su lado.;;;;;;;;;x
EVTOPTA_TOG_3256;[This.Religion.GetRandomGodNameCap] preserve us...;Que [This.Religion.GetRandomGodName] nous prťserve.;[This.Religion.GetRandomGodNameCap] rette uns!;;[This.Religion.GetRandomGodNameCap] protťgenosÖ;;;;;;;;;x
EVTDESC_TOG_3257;A solemn procession of maidens led by [From.GetTitledName] finally emerges from the grove, but there is no sign of [FromFrom.GetFirstName]. It is done, [From.GetFirstName] announces. The demon is no more... but I fear there was no way to save your child. The corruption simply went too deep.;Une procession solennelle de jeunes filles, guidťe par [From.Get_le_TitledName], ťmerge finalement du bosquet, mais nul signe de [FromFrom.GetFirstName]. ę†C'est fait, annonce [From.GetFirstName]. Le dťmon n'est plus... mais je crains de n'avoir pu sauver votre enfant. Le mal ťtait trop enracinť.†Ľ;Eine feierliche Prozession von Mšdchen, angefŁhrt von [From.GetTitledName], verlšsst endlich den Hain, aber ohne ein Zeichen von [FromFrom.GetFirstName]. "Es ist vollbracht," meint [From.GetFirstName]. "Der Dšmon ist nicht mehr... doch ich fŁrchte, es gab keinen Weg, das Kind zu retten. Das Verderben war schon zu tief eingedrungen.";;Una solemne procesiůn de doncellas lideradas por [From.GetTitledName] finalmente emerge del bosque, pero no hay ninguna seŮal de [FromFrom.GetFirstName]. Ya estŠ hecho, anuncia [From.GetFirstName]. El demonio ya no estŠ... pero me temo que no ha habido manera de salvar a tu hijo. La corrupciůn simplemente fue demasiado profunda.;;;;;;;;;x
EVTOPTA_TOG_3257;Then your life is forfeit as well, witch!;Vous paierez de votre vie, sorciŤre†!;Dann ist auch Euer Leben verwirkt, Hexe!;;°Entonces tambiťn perderŠs tu vida, buja!;;;;;;;;;x
EVTOPTB_TOG_3257;Leave while you still can, [From.GetFirstName], and never return.;Sauvez-vous pendant que vous le pouvez, [From.GetFirstName], et ne revenez plus jamais.;Verschwindet, so lange Ihr noch kŲnnt, und kehrt niemals zurŁck, [From.GetFirstName].;;Vete mientras puedas, [From.GetFirstName], y no vuelvas nunca.;;;;;;;;;x
EVTOPTC_TOG_3257;You have my thanks... it had to be done.;Je vous remercie... ce devait Ítre fait.;Ich danke Euch... es musste vollbracht werden.;;Te doy las graciasÖ habŪa que hacerlo.;;;;;;;;;x
EVTDESC_TOG_3258;The chanting from the grove comes closer and [From.GetTitledName] appears together with [FromFrom.GetFirstName], flanked on either side by singing maidens. The child looks shaken, but otherwise unharmed. It is done, [From.GetFirstName] announces. The demon is no more. [FromFrom.GetFirstName] is [FromFrom.GetHerselfHimself] again.;Les chants qui proviennent du bosquet se rapprochent et [From.Get_le_TitledName] apparaÓt en compagnie de [FromFrom.GetFirstName] et entourť des jeunes filles qui chantent. L'enfant semble secouť mais sain et sauf. ę†C'est fait†Ľ, annonce [From.GetFirstName]. ę†Le dťmon n'est plus. [FromFrom.GetFirstName] est de nouveau [FromFrom.GetLuiElle]-mÍme.†Ľ;Die Gesšnge aus dem Hain kommen nšher und [From.GetTitledName] erscheint zusammen mit [FromFrom.GetFirstName], flankiert von singenden Mšdchen. Das Kind wirkt verwirrt, aber unverletzt. "Es ist vollbracht," ruft [From.GetFirstName] aus. "Der Dšmon ist hinfort. [FromFrom.GetFirstName] ist wieder [FromFrom.GetHerselfHimself].";;Los cantos de la arboleda se oyen mŠs cerca y [From.GetTitledName] aparece junto a [FromFrom.GetFirstName], flanqueado a ambos lados por doncellas cantando. El niŮo se ve sacudido, pero por lo demŠs sano y salvo. Ya estŠ hecho, anuncia [From.GetFirstName]. El demonio ya no existe. [FromFrom.GetFirstName] es [FromFrom.GetHerselfHimself] de nuevo.;;;;;;;;;x
EVTOPTA_TOG_3258;Thank the gods!;Les dieux soient louťs†!;Den GŲttern sei gedankt!;;°Gracias a los dioses!;;;;;;;;;x
EVTDESC_TOG_3259;The chanting from the grove comes closer and [From.GetTitledName] appears together with [FromFrom.GetFirstName], flanked on either side by singing maidens. The child's vacant stare hints that something is wrong. It is done, [From.GetFirstName] announces. The demon is no more, but the struggle was great. I fear it has left scars on [FromFrom.GetFirstName] that may never heal...;Les chants qui proviennent du boisť se rapprochent et [From.Get_le_TitledName] apparaÓt avec [FromFrom.GetFirstName], entourťs de jeunes filles qui chantent. Le regard fixe et vide de votre enfant indique que quelque chose ne tourne pas rond. 'C'est fait, annonce [From.GetFirstName]. Le dťmon n'est plus, mais ce fut une dure bataille. Je crains que [FromFrom.GetFirstName] n'ait subi d'incurables sťquelles.';Die Gesšnge aus dem Hain kommen nšher und [From.GetTitledName] erscheint zusammen mit [FromFrom.GetFirstName], flankiert von singenden Mšdchen. Der starre Blick des Kindes zeigt, dass etwas nicht stimmt. "Es ist vollbracht," ruft [From.GetFirstName] aus. "Der Dšmon ist hinfort, doch der Kampf war schwer. Ich fŁrchte, er hat bei [FromFrom.GetFirstName] Narben hinterlassen, die vielleicht niemals heilen werden...";;Los cantos de la arboleda se oyen mŠs cerca y [From.GetTitledName] aparece junto a [FromFrom.GetFirstName], flanqueado a ambos lados por doncellas cantando. La vacante mirada del niŮo revela que algo anda mal. Ya estŠ hecho, anuncia [From.GetFirstName]. El demonio ya no existe, pero la lucha fue enorme. Me temo que ha dejado cicatrices en [FromFrom.GetFirstName] que quizŠ nunca curen...;;;;;;;;;x
EVTDESC_TOG_3218;The corpse of [From.GetTitledName] was discovered today at the bottom of a steep ravine with a broken neck. It seems to have been a tragic accident ordained by the gods, but strangely, [FromFrom.GetFirstName] was seen standing next to the ravine, peering down into it just before the tragedy was revealed.;Le corps [From.Get_du_TitledName] a ťtť dťcouvert aujourd'hui au fond d'un ravin escarpť, le cou brisť. Ce semble Ítre un tragique accident, un ch‚timent des dieux, mais, ťtrangement, peu de temps avant qu'on ait eu vent de cette tragťdie, on a vu [FromFrom.GetFirstName] prŤs du ravin, observant quelque chose en contrebas.;Die Leiche von [From.GetTitledName] wurde heute, am Boden einer steilen Schlucht mit gebrochenem Genick, entdeckt. Es scheint ein tragischer Unfall zu sein, hervorgebracht durch den Willen der GŲtter, doch seltsamerweise wurde [FromFrom.GetFirstName] ganz in der Nšhe gesehen, kurz bevor die TragŲdie entdeckt wurde.;;El cadŠver de [From.GetTitledName] fue descubierto hoy en el fondo de un barranco con el cuello roto. Parece haber sido un trŠgico accidente ordenado por los dioses, pero extraŮamente, [FromFrom.GetFirstName] fue visto de pie junto a la quebrada, mirando hacia abajo justo antes de que se produjera la tragedia.;;;;;;;;;x
EVTOPTA_TOG_3218;Curious...;Curieux...;Seltsam...;;CuriosoÖ;;;;;;;;;x
EVTDESC_TOG_3221;[From.GetTitledName] was found impaled on a wooden fence just outside your longhouse this morning. You can only deduce that [From.GetSheHe] fell on the fence from the roof of your longhouse, though what business [From.GetSheHe] had up there you cannot fathom. Poor [FromFrom.GetFirstName] was the first one to lay eyes on the gruesome scene...;Ce matin, [From.Get_le_TitledName] a ťtť trouvť[From.Get_E] empalť[From.Get_E] sur une clŰture de bois ŗ l'extťrieur de la maison longue. Vous dťduisez qu'[From.GetIlElle] ťtait sur le toit de la maison longue avant de tomber sur la clŰture, mais ce qu'[From.GetIlElle] y faisait, vous n'en avez aucune idťe. Pauvre [FromFrom.GetFirstName] qui a vu cette horrible scŤne en premier... ;[From.GetTitledName] wurde, direkt vor Eurem Langhaus auf einem Holzzaun aufgespieŖt, gefunden. Es scheint, als sei [From.GetSheHe] vom Dach deines Langhauses gefallen, doch was [From.GetSheHe] dort oben zu tun hatte, ist unklar. [FromFrom.GetFirstName] erblickte die grauenvolle Szene unglŁckseligerweise als Erstes...;;[From.GetTitledName] fue encontrado esta maŮana atravesado en una valla de madera fuera de tu casa comunal. Sůlo puedes deducir que [From.GetSheHe] se cayů en la valla desde el tejado de la casa comunal, aunque lo que [From.GetSheHe] hacŪa allŪ arriba no lo puedes comprender. El pobre [FromFrom.GetFirstName] fue el primero en ver la horripilante escena...;;;;;;;;;x
EVTOPTA_TOG_3221;Yes, an interesting coincidence...;En effet, c'est une ťtrange coÔncidence...;Welch seltsamer Zufall...;;SŪ, una interesante coincidenciaÖ;;;;;;;;;x
EVTDESC_TOG_3224;[From.GetTitledName] was found stuffed head first into a barrel full of rain water this morning, with only [From.GetHerHis] pale, rigid legs visible above the surface. Your guards speculate that [From.GetSheHe] tripped, somehow fell into the barrel and then tragically drowned. [FromFrom.GetFirstName] was found playing just nearby, but doesn't seem to have seen anything.;Ce matin, [From.Get_le_TitledName] a ťtť trouvť[From.Get_E] la tÍte au fond du tonneau d'eau de pluie, on ne voyait dťpasser que ses jambes pales et raides. Vos gardes prťsument qu'[From.GetIlElle] a trťbuchť et glissť dans le tonneau, se noyant ainsi. [FromFrom.GetFirstName] jouait dans les parages, mais n'a semble-t-il rien vu.;[From.GetTitledName] wurde heute morgen Kopf voran in einem Wasserfass gefunden, nur die fahlen, starren Beine sichtbar Łber der Wasseroberflšche. Eure Wachen spekulieren, dass [From.GetSheHe] stolperte, irgendwie in das Fass fiel und ertrank. [FromFrom.GetFirstName] spielte ganz in der Nšhe, hat aber scheinbar nichts gesehen. ;;[From.GetTitledName] fue encontrado esta maŮana con la cabeza metida en un barril lleno de agua de lluvia, con sůlo [From.GetHerHis] pŠlidas y rŪgidas piernas visibles sobre la superficie. Tus guardias especulan que [From.GetSheHe] se tropezů, de alguna manera cayů en el barril y luego se ahogů trŠgicamente. [FromFrom.GetFirstName] fue encontrado jugando muy cerca, pero no parece haber visto nada.;;;;;;;;;x
EVTOPTA_TOG_3224;Yes... I suppose it could have happened that way...;Oui... Je suppose que c'est arrivť ainsi...;Ja... Ich glaube, es kŲnnte so passiert sein.;;SŪÖ Supongo que puede haber pasado asŪÖ;;;;;;;;;x
e_mongol_empire;Mongol Empire;Empire mongol;Mongolisches Imperium;;Imperio Mongol;;;;;;;;;x
e_mongol_empire_adj;Mongol;mongole;Mongolisch;;Mongol;;;;;;;;;x
BM_THE_MONGOLS;The Mongols;Les Mongols;Die Mongolen;;Los Mongoles;;;;;;;;;x
