#CODE;ENGLISH;FRENCH;GERMAN;;SPANISH;;;;;;;;;x
EVTDESC_TOG_181;With the present war, the Great Hunt has been called off and you and your men will have to get your training hunting the most dangerous game of all Ė Man. Perhaps when the dust has settled and peace returned, a new Nerge can be organized.;En raison de la guerre en cours, on a interrompu la Grande Chasse et vous et vos hommes devrez vous entraÓner en chassant le plus dangereux de tout le gibier†: l'homme. Peut-Ítre que lorsque la poussiŤre sera retombťe et que la paix sera revenue nous pourrons organiser une nouvelle Nerge.  ;Die GroŖe Jagd wurde wegen des gegenwšrtigen Krieges abgesagt und Eure Mšnner werden sich darin Łben, das gefšhrlichste Tier aller Zeiten zu jagen Ė den Menschen. Wenn sich der Staub legt und Frieden einkehrt, kann vielleicht eine neue Nerge organisiert werden.;;Con la guerra actual, la Gran CacerŪa ha sido cancelada y tķ y tus hombres tendrťis que convertir vuestra caza de entrenamiento en el juego mŠs peligroso de todos: cazar al hombre. Tal vez cuando el polvo se haya asentado y la paz retornado, se pueda organizar una nueva Nerge.;;;;;;;;;x
EVTOPTA_TOG_181;A different breed of hunt, but a hunt all the same.;C'est une espŤce diffťrente, mais une chasse reste une chasse.;Eine andere Art der Jagd, aber dennoch eine Jagd wie jede andere.;;Una variedad distinta de caza, pero caza al fin y al cabo.;;;;;;;;;x
hold_blot;Hold a Great Blot;Tenir un grand blůt ;Haltet ein Blůt ab;;Celebrar una Gran Mancha;;;;;;;;;x
hold_blot_desc;Hold a great blot together with your vassals and offer sacrifice to the gods for good harvests and success on the battlefield. This can only be done every ninth year.;Tenez un grand blůt accompagnť de vos vassaux et offrez des sacrifices aux dieux en remerciement pour les bonnes rťcoltes et pour le succŤs sur le champ de bataille. Cela ne se fait qu'une fois tous les neuf ans.;Haltet mit Euren Vasallen ein Blůt ab und dankt den GŲttern fŁr gute Ernten und Erfolge auf dem Schlachtfeld. Dies kann nur jedes neunte Jahr durchgefŁhrt werden.;;Celebrar una gran mancha junto con tus vasallos y ofrecer sacrificios a los dioses por buenas cosechas y el ťxito en el campo de batalla. Esto sůlo puede hacerse cada nueve aŮos.;;;;;;;;;x
held_blot_modifier;Sacrificed to the Gods;Offert en sacrifice aux dieux;Den GŲttern geopfert;;Sacrificado a los Dioses;;;;;;;;;x
prepare_blot;You begin preparations for the blot.\n;Vous commencez les prťparatifs pour le blůt.\n;Ihr beginnt mit Vorbereitungen fŁr das Opfer.\n;;Empiezas la preparaciůn de la mancha.\n;;;;;;;;;x
blot_begins;The hangman readies his rope.;Le bourreau prťpare sa corde.;Der Henker bereitet das Seil vor.;;El verdugo prepara su cuerda.;;;;;;;;;x
feast_begins;Vassal opinion increases by ßG+15ß! for ßY12ß! months.\nYou move inside the large feast hall...;L'opinion d'un vassal augmente de ßG+15ß! pendant ßY12ß! mois.\nVous pťnťtrez dans la grande salle des fÍtes...;Die Meinung Eurer Vasallen von Euch erhŲht sich um ßG+15ß! fŁr ßY12ß! Monate.\nIhr schlendert durch die riesige Trinkhalle ...;;Te mueves a dentro de la gran sala de fiestas.;;;;;;;;;x
ukon_juhla_begins;You watch as the dancing flames rise towards the sky.;Vous observez les flammes qui dansent vers le ciel.;Ihr beobachtet, wie die tanzenden Flammen in den Himmel aufsteigen.;;Puedes ver como las llamas se elevan hacia el cielo.;;;;;;;;;x
uzgavenes_begins;It looks like spring shall come this year.;Le printemps viendra cette annťe, semble-t-il.;Wie es aussieht, wird es dieses Jahr einen FrŁhling geben.;;Parece que la primavera vendrŠ este aŮo.;;;;;;;;;x
EVTDESC_TOG_600;You have sent out summons to all of your vassals for the blot. Those that have been baptized or profess to follow the teachings of the Prophet will have to offer gold to be exempted from this magnificent feast.;Vous avez envoyť un avis de convocation ŗ tous vos vassaux pour le blůt. Ceux qui ont ťtť baptisťs ou qui affirment suivre l'enseignement du prophŤte devront offrir de l'or pour Ítre exemptťs de ce festin majestueux. ;Ihr habt all Eure Vasallen zum Blůt zusammengerufen. Diejenigen, die getauft wurden oder den Lehren des Propheten folgen, mŁssen Gold anbieten, um von diesem groŖartigen Gelage fernbleiben zu kŲnnen.;;Has enviado citaciones a todos tus vasallos para la mancha. Los que han sido bautizados o profesan seguir las enseŮanzas del profeta tendrŠn que ofrecer oro para quedar exentos de esta magnŪfica fiesta.;;;;;;;;;x
EVTOPTA_TOG_600;I can hardly wait!;Je ne peux plus attendre†!;Ich kann es kaum erwarten!;;°No puedo esperar!;;;;;;;;;x
EVTTOOLTIP_TOG_601;Summoned to blot.;Convocation au blůt;Zur Teilnahme am Blůt gerufen.;;Convocado a mancha.;;;;;;;;;x
EVTTOOLTIP_TOG_602;Exempted from blot.;Exemption de blůt;Vom Blůt ausgeschlossen.;;Exentos de mancha.;;;;;;;;;x
EVTDESC_TOG_601;Your wise liege, [From.GetTitledFirstName], has summoned you and [From.GetHerHis] other vassals to a blot. There you will worship and give sacrifice to the gods before taking part in a great feast where you drink to their name.;Votre sage [From.GetLordLady] lige, [From.Get_le_TitledFirstName], vous a convoquť[Root.Get_E], vous et ses autres vassaux, pour assister au blůt. Vous y vťnťrerez les dieux et vous leur ferez des offrandes avant de prendre part ŗ un grand festin oý vous boirez en leur nom.;Euer weiser Lehnsherr, [From.GetTitledFirstName], hat Euch und [From.GetHerHis]e anderen Vasallen zu einem Blůt eingeladen. Dort werdet Ihr den GŲttern huldigen und ihnen Opfer bringen, bevor Ihr an einem gewaltigen Gelage teilnehmt, wo Ihr auf ihren Namen anstoŖen werdet.;;Tu sabio seŮor, [From.GetTitledFirstName], te ha convocado a ti y a [From.GetHerHis] otros vasallos a una mancha. AllŪ podrŠs adorar y dar sacrificio a los dioses antes de tomar parte en una gran fiesta donde se bebe en su nombre.;;;;;;;;;x
EVTOPTA_TOG_601;I wouldn't miss it.;Je ne veux pas manquer Áa.;Das will ich nicht verpassen.;;No me lo perderŪa.;;;;;;;;;x
EVTDESC_TOG_602;Your liege, [From.GetTitledFirstName], remains trapped in [From.GetHerHis] heathen ways, and now [From.GetSheHe] has summoned all of [From.GetHerHis] vassals to a blot where [From.GetSheHe] intends to give sacrifice to [From.GetHerHis] pagan gods. Since you do not practise their heathen religion, you will be expected to contribute gold in order to be exempted from this ceremony.;Votre [From.GetLordLady] lige, [From.Get_le_TitledFirstName], demeure prisonni[From.GetErEre] de ses moeurs paÔennes et a convoquť tous ses vassaux ŗ assister au blůt lors duquel [From.GetIlElle] compte faire des offrandes ŗ ses dieux paÔens. Puisque vous ne pratiquez pas leur religion paÔenne, vous devrez donner de l'or pour Ítre exemptť de cette cťrťmonie. ;Euer Lehnsherr, [From.GetTitledFirstName], ist weiterhin gefangen in [From.GetHerHis]en ketzerischen Pfaden und [From.GetSheHe] hat nun all [From.GetHerHis]e Vasallen zu einem Blůt herbeigeordert, bei dem [From.GetSheHe] [From.GetHerHis]en heidnischen GŲttern Opfergaben darbringen will. Da Ihr diese heidnische Religion nicht praktiziert, wird erwartet, dass Ihr Gold beisteuert, um Euch von dieser Zeremonie freizukaufen.;;Tu seŮor, [From.GetTitledFirstName], sigue atrapado en [From.GetHerHis] formas paganas, y ahora [From.GetSheHe] ha convocado a todos [From.GetHerHis] vasallos a una mancha donde [From.GetSheHe] tiene la intenciůn de dar sacrificio a [From.GetHerHis] dioses paganos. Dado que no practicas su religiůn pagana, se espera que contribuyas con oro con el fin de quedar exento de esta ceremonia.;;;;;;;;;x
EVTOPTA_TOG_602;I suppose I have no choice in the matter.;J'imagine que je n'ai pas le choix.;Da habe ich wohl keine andere Wahl.;;Supongo que no tengo otra opciůn.;;;;;;;;;x
EVTOPTB_TOG_602;As [This.Religion.GetRandomGodNameCap] is my witness, I shan't pay!;[This.Religion.GetRandomGodNameCap] m'en est tťmoin, je ne paierai pas†!;[This.Religion.GetRandomGodNameCap] sei mein Zeuge, ich werde nicht zahlen!;;Como [This.Religion.GetRandomGodNameCap] es mi testigo, °no pagarť!;;;;;;;;;x
EVTTOOLTIP_TOG_603;Your payment is received.;Votre paiement a ťtť reÁu. ;Eure Zahlung wurde erhalten.;;Tu pago es recibido.;;;;;;;;;x
EVTDESC_TOG_603;[From.GetTitledFirstName], your vassal, is stubborn in [From.GetHerHis] ways and speaks only of the mercy of [From.Religion.GetRandomGodNameCap], but [From.GetSheHe] has wisely decided to offer you some gold to be exempted from the blot.;[From.Get_Le_TitledFirstName], votre vassal[From.Get_E], s'entÍte et ne parle que de la misťricorde que [From.Religion.GetRandomGodName] lui accorde. Cependant, [From.GetIlElle] a sagement dťcidť de vous offrir de l'or pour se libťrer de l'obligation d'assister au blůt. ;[From.GetTitledFirstName], Euer Vasall, ist stur und spricht nur noch von [From.GetHerHis]em falschen Glauben. [From.Religion.GetRandomGodNameCap] soll angeblich gnšdig sein. Welch ein Unsinn. Doch wenigstens hat [From.GetSheHe] in [From.GetHerHis]er Weisheit beschlossen, Euch etwas Gold anzubieten, um dem Blůt fernbleiben zu kŲnnen.;;[From.GetTitledFirstName], tu vasallo, es terco en [From.GetHerHis] modos y solo habla de la misericordia de [From.Religion.GetRandomGodNameCap], pero [From.GetSheHe] ha decidido sabiamente ofrecerte un poco de oro para quedar exento de la mancha.;;;;;;;;;x
EVTOPTA_TOG_603;As well [From.GetSheHe] should.;[From.GetIlElleCap] fait bien.;Das sollte [From.GetSheHe] auch.;;AsŪ que [From.GetSheHe] deberŪa.;;;;;;;;;x
EVTTOOLTIP_TOG_636;Your refusal to pay is received.;Votre refus de payer a ťtť reÁu.;Eure Weigerung zu zahlen wurde erhalten.;;Se recibe tu negativa a pagar.;;;;;;;;;x
EVTDESC_TOG_636;Despite having sworn you fealty, [From.GetTitledFirstName] refuses to offer gold in order to be exempted from the blot! According to [From.GetFirstName], [From.Religion.GetRandomGodName] would not forgive [From.GetHerHim] if [From.GetSheHe] contributed as much as a single copper to a heathen festival.;Malgrť son serment, [From.Get_le_TitledFirstName] refuse de vous offrir de l'or afin de se libťrer de l'obligation d'assister au blůt†! Selon [From.GetLuiElle], [From.Religion.GetRandomGodName] ne lui pardonnerait pas [From.GetSilSielle] donnait ne serait-ce qu'une seule piŤce de cuivre ŗ une 'fÍte paÔenne'.  ;Trotz des Treueschwurs Euch gegenŁber weigert sich [From.GetTitledFirstName], Euch Gold anzubieten, um dem Blůt fernbleiben zu kŲnnen! Laut [From.GetFirstName] wŁrde [From.Religion.GetRandomGodName] es [From.Getihmihr] nie verzeihen, wenn [From.GetSheHe] auch nur einen einzigen Kupferschilling zu einem "ketzerischen Fest" beitragen wŁrde.;;A pesar de haberte jurado lealtad, °[From.GetTitledFirstName] se niega a ofrecer oro para quedar exento de la mancha!. Segķn [From.GetFirstName], [From.Religion.GetRandomGodName] no perdonarŠ a [From.GetHerHim] si [From.GetSheHe] ha contribuido con un solo cobre para una fiesta pagana.;;;;;;;;;x
EVTOPTA_TOG_636;This insult will not be forgotten.;On n'oubliera pas cette insulte de sitŰt.;Diese Beleidigung wird nicht vergessen werden.;;Este insulto no serŠ olvidado.;;;;;;;;;x
EVTDESC_TOG_604;The guests have arrived, and the time has come for the blot to begin! You gather outside the temple, and start by offering animals as sacrifice to the gods. While their meat is prepared for the feast that is to follow, the blood is sprinkled on statues of Odin, Thor, Freyr and the other gods, as well as on the worshipers themselves.;Les invitťs sont arrivťs et il est temps de commencer le blůt†! Vous vous rassemblez devant le temple et commencez par offrir des animaux en sacrifice aux dieux. Tandis qu'on prťpare leur viande pour le festin qui doit suivre, on arrose de leur sang les statues d'Odin, de Thor, de Freyr et des autres dieux, ainsi que les adorateurs eux-mÍmes.;Die Gšste sind angekommen und die Zeit fŁr das Blůt ist gekommen! Alle versammeln sich auŖerhalb des Tempels und man beginnt mit den Tieropfern an die GŲtter. Wšhrend ihr Fleisch fŁr das nachfolgende Gelage vorbereitet wird, wird ihr Blut auf die Statuen von Odin, Thor, Freyr und die anderen GŲtter gespritzt und auch auf die Betenden selbst.;;Los invitados han llegado, y °ha llegado el momento de que la mancha comience! Te reķnes fuera del templo, y comienzas ofreciendo animales como sacrificio a los dioses. Mientras se prepara la carne para la fiesta que va a seguir, la sangre salpica las estatuas de OdŪn, Thor, Freyr y los otros dioses, asŪ como a los mismŪsimos fieles.;;;;;;;;;x
EVTOPTA_TOG_604;Now for the human sacrifice...;Et maintenant, le sacrifice humain...;Und jetzt zum Menschenopfer...;;Ahora, para el sacrificio humano...;;;;;;;;;x
EVTDESC_TOG_605;The time has come for the blot held by [From.GetTitledFirstName] to begin! You gather outside the temple, and start by offering animals as sacrifice to the gods. While their meat is prepared for the feast that is to follow, the blood is sprinkled on statues of Odin, Thor, Freyr and the other gods, as well as on the worshipers themselves.;Il est temps de commencer le blůt tenu par [From.Get_le_TitledFirstName]†! Vous vous rassemblez devant le temple et commencez par offrir des animaux en sacrifice aux dieux. Tandis qu'on prťpare leur viande pour le festin qui doit suivre, on arrose de leur sang les statues d'Odin, de Thor, de Freyr et des autres dieux, ainsi que les adorateurs eux-mÍmes.;Die Zeit fŁr das von [From.GetTitledFirstName] veranstaltete Blůt ist gekommen! Alle versammeln sich auŖerhalb des Tempels und man beginnt mit den Tieropfern an die GŲtter. Wšhrend ihr Fleisch fŁr das nachfolgende Gelage vorbereitet wird, wird ihr Blut auf die Statuen von Odin, Thor, Freyr und die anderen GŲtter gespritzt und auch auf die Betenden selbst.;;°Ha llegado el momento de empezar la mancha celebrada por [From.GetTitledFirstName]!. Te reķnes fuera del templo, y comienzas ofreciendo animales como sacrificio a los dioses. Mientras se prepara la carne para la fiesta que va a seguir, la sangre salpica las estatuas de OdŪn, Thor, Freyr y los otros dioses, asŪ como a los mismŪsimos fieles.;;;;;;;;;x
EVTDESC_TOG_606;Although you have been told little, the noise from outside your dungeon is enough to make it clear that your captor, [Root.Host.GetTitledFirstName] is holding a blot where [Root.Host.GetSheHe] will offer sacrifice in worship of [Root.Host.GetHerHis] gods. Guards burst inside your cell and drag you away to the gallows outside the local temple... ;MÍme si on ne vous en a pas dit beaucoup, le bruit provenant de l'extťrieur de votre cachot suffit ŗ confirmer que [Root.Host.Get_le_TitledFirstName], votre ravisseu[Root.Host.GetXSe], prťpare un blůt au cours duquel des offrandes seront sacrifiťes aux dieux qu'il vťnŤre. Des gardes surgissent dans votre cellule et vous traÓnent jusqu'ŗ la potence devant le temple local...;Auch wenn Euch keiner wirklich irgendetwas erzšhlt hat, so lassen die Geršusche auŖerhalb Eures Verlieses darauf schlieŖen, dass Euer Kidnapper [Root.Host.GetTitledFirstName] ein Blůt abhšlt, um [Root.Host.GetHerHis]en GŲttern zu huldigen. Wachen platzen in Eure Zelle und zerren Euch hinaus durch die Tunnel, in Richtung des Tempels...;;Aunque poco te han dicho, el ruido fuera de tu mazmorra es suficiente para dejar claro que tu captor, [Root.Host.GetTitledFirstName] estŠ celebrando una mancha donde [Root.Host.GetSheHe] ofrecerŠ sacrificio en la adoraciůn de [Root.Host.GetHerHis] dioses. Los guardias irrumpen en el interior de tu celda y te arrastran a la horca fuera del templo local...;;;;;;;;;x
EVTOPTA_TOG_606;No! Not like this!;Non†! Pas comme Áa†!;Nein! Nicht so!;;°No! °AsŪ no!;;;;;;;;;x
EVTDESC_TOG_610;[From.GetTitledFirstName] is brought up from your dungeons and escorted to the temple. A noose is placed around [From.GetHerHis] neck and the rope is thrown over a sturdy branch of a nearby oak. A small yellow pool forms at [From.GetFirstName]'s feet.;On escorte [From.Get_le_TitledFirstName] depuis les cachots jusqu'au temple. On lui passe la corde autour du cou, attachťe ŗ la branche solide d'un chÍne ŗ proximitť. Une petite flaque jaun‚tre se forme ŗ ses pieds.;[From.GetTitledFirstName] wird aus Eurem Verlies geholt und zum Tempel eskortiert. Eine Schlinge wird um [From.GetHerHis]en Hals gelegt und das Seil an einem stabilen Ast einer Eiche befestigt. Eine kleine gelbliche PfŁtze bildet sich unter [From.GetFirstName]s FŁŖen.;;[From.GetTitledFirstName] es traŪdo de tu mazmorra y escoltado al templo. Se coloca una soga alrededor de [From.GetHerHis] cuello y la cuerda se lanza sobre una gruesa rama de un roble cercano. Se forma una pequeŮa piscina de color amarillo a los pies de [From.GetFirstName].;;;;;;;;;x
EVTOPTA_TOG_610;Allfather, we offer you this sacrifice...;PŤre de tout, nous vous offrons ce sacrifice...;Allvater, wir bieten dir dieses Opfer an...;;Padre de Todos, te ofrecemos este sacrificio...;;;;;;;;;x
EVTOPTB_TOG_610;No, I have changed my mind.;Non, j'ai changť d'avis.;Nein, ich habe meine Meinung gešndert.;;No, he cambiado de opiniůn.;;;;;;;;;x
EVTDESC_TOG_611;[From.GetTitledFirstName] is brought up from your dungeons and escorted to the temple. As the noose is placed around [From.GetHerHis] neck, [From.GetSheHe] steadies [From.GetHerselfHimself] and murmurs several passages that you recognize as being from the Christian holy book.;On escorte [From.Get_le_TitledFirstName] depuis les cachots jusqu'au temple. Pendant qu'on lui passe la corde autour du cou, [From.GetIlElle] se tient fermement et murmure plusieurs passages que vous reconnaissez comme provenant du livre sacrť des chrťtiens.;[From.GetTitledFirstName] wird aus Eurem Verlies geholt und zum Tempel eskortiert. Als eine Schlinge um [From.GetHerHis]en Hals gelegt wird, bleibt [From.GetSheHe] standhaft und murmelt zahlreiche Verse, die Ihr als Passagen aus dem christlichen Heiligen Buch erkennt.;;[From.GetTitledFirstName] es traŪdo de tu mazmorra y escoltado al templo. Mientras le ponen la soga alrededor de [From.GetHerHis] cuello, [From.GetSheHe] se estabiliza a [From.GetHerselfHimself] y murmura varios pasajes que reconoces son del libro sagrado Cristiano.;;;;;;;;;x
EVTOPTA_TOG_611;Where is your Blessed Virgin now, [From.GetFirstName]?;Elle est oý, maintenant, votre Sainte Vierge, [From.GetFirstName]†?;Wo ist Eure Heilige Jungfrau jetzt, [From.GetFirstName]?;;ŅDůnde estŠ tu SantŪsima Virgen ahora, [From.GetFirstName]?;;;;;;;;;x
EVTOPTB_TOG_611;No, perhaps this is a bad idea...;Non, ce n'est peut-Ítre pas une bonne idťe...;Nein, das ist vielleicht eine schlechte Idee...;;No, tal vez esto es una mala idea...;;;;;;;;;x
EVTDESC_TOG_612;[From.GetTitledFirstName] is brought up from your dungeons and escorted to the temple. Your guards place the noose around [From.GetHerHis] neck while [From.GetSheHe] murmurs a passage with closed eyes from the Mohammedan holy book.;On escorte [From.Get_le_TitledFirstName] depuis les cachots jusqu'au temple. Pendant qu'on lui passe la corde autour du cou, [From.GetIlElle], les yeux clos, murmure un passage du livre sacrť de Mahomet.;[From.GetTitledFirstName] wird aus Eurem Verlies geholt und zum Tempel eskortiert. Eure Wachen befestigen eine Schlinge um [From.GetHerHis]en Hals, wšhrend [From.GetSheHe] mit geschlossenen Augen eine Passage aus dem mohammedanischen Heiligen Buch murmelt.;;[From.GetTitledFirstName] es traŪdo de tu mazmorra y escoltado al templo. Tus guardias le ponen la soga alrededor de [From.GetHerHis] cuello mientras [From.GetSheHe] murmura con los ojos cerrados un pasaje del libro sagrado Mahometano.;;;;;;;;;x
EVTOPTA_TOG_612;Soon you shall meet your Prophet, friend.;BientŰt, l'ami, vous rejoindrez votre prophŤte.;Schon bald werdet Ihr Eurem Propheten gegenŁberstehen, Freund.;;Pronto conocerŠs a tu Profeta, amigo.;;;;;;;;;x
EVTOPTB_TOG_612;No, perhaps this is a bad idea...;Non, ce n'est peut-Ítre pas une bonne idťe...;Nein, das ist vielleicht eine schlechte Idee...;;No, tal vez esto es una mala idea...;;;;;;;;;x
EVTDESC_TOG_613;Your brother, [From.GetTitledFirstName], is brought up from his dungeon and escorted to the temple. As the noose is placed around his neck, he looks at you with pleading eyes. Don't do this, [Root.GetFirstName]. There has to be some other way...;Votre frŤre, [From.Get_le_TitledFirstName], est escortť depuis les cachots jusqu'au temple. Pendant qu'on lui passe la corde autour du cou, il vous fixe d'un regard suppliant comme s'il disait†: 'Ne fais pas Áa, [Root.GetFirstName]. Il doit bien y avoir une autre solution...';Euer Bruder, [From.GetTitledFirstName], wird aus Eurem Verlies geholt und zum Tempel eskortiert. Als eine Schlinge um seinen Hals gelegt wird, blickt er Euch aus flehenden Augen an. "Tut das nicht, [Root.GetFirstName]. Es muss einen anderen Weg geben...";;Tu hermano, [From.GetTitledFirstName], es traŪdo desde su mazmorra y escoltado al templo. Mientras le ponen la soga al cuello, te mira con ojos suplicantes. No hagas esto, [Root.GetFirstName]. Tiene que haber otra manera...;;;;;;;;;x
EVTOPTA_TOG_613;I'm afraid not. Do it, men.;J'ai bien peur que non. Soldats, poursuivez.;Ich fŁrchte nicht. Macht weiter, Mšnner.;;Me temo que no. Hacedlo, hombres.;;;;;;;;;x
EVTOPTB_TOG_613;No, I can't do this to my own brother...;Non, je ne peux pas faire Áa ŗ mon propre frŤre...;Nein, ich kann das meinem eigenen Bruder nicht antun.;;No, no puedo hacer esto a mi propio hermano...;;;;;;;;;x
EVTDESC_TOG_614;Your sister, [From.GetTitledFirstName], is dragged up from her dungeon and escorted to the temple. She looks up at you with tears streaming down her face as your guards place the noose around her neck. Please, [Root.GetFirstName], she says with a trembling voice. Don't let them do this.;Votre soeur, [From.Get_le_TitledFirstName], est escortťe depuis les cachots jusqu'au temple. Le visage en larmes, elle vous regarde pendant que les gardes lui passent la corde autour du cou et elle prononce d'une voix tremblotante†: 'Je t'en supplie, [Root.GetFirstName]. Ne les laisse pas faire Áa.';Eure Schwester, [From.GetTitledFirstName], wird aus Eurem Verlies geholt und zum Tempel eskortiert. Sie blickt Euch aus tršnenŁberstrŲmtem Gesicht an, als die Wachen die Schlinge um ihren Hals legen. "Bitte, [Root.GetFirstName]", sagt sie mit zitternder Stimme. "Bitte lasst das nicht zu.";;Tu hermana, [From.GetTitledFirstName], es arrastrada desde su mazmorra y escoltada al templo. Te mira con lŠgrimas en su rostro mientras tus guardias le ponen la soga alrededor del cuello. Por favor, [Root.GetFirstName], dice con voz temblorosa. No dejes que lo hagan.;;;;;;;;;x
EVTOPTA_TOG_614;There can be no turning back now. I'm sorry.;On ne peut plus revenir en arriŤre. Je suis dťsolť.;Es gibt keinen Weg zurŁck. Es tut mir leid.;;No puede haber vuelta atrŠs. Lo siento.;;;;;;;;;x
EVTOPTB_TOG_614;No... not my own sister...;Non... pas ma propre soeur...;Nein... nicht meine eigene Schwester...;;No... no a mi propia hermana...;;;;;;;;;x
EVTDESC_TOG_615;The guards drag your father, [From.GetTitledFirstName], from his dungeon and escort him to the temple where they place the noose around his neck. My [Root.GetSonDaughter], he croaks while looking at you. Can't you find it in your heart to forgive me?;Les gardes escortent votre pŤre, [From.Get_le_TitledFirstName], depuis les cachots jusqu'au temple oý ils lui passent la corde autour du cou. 'Mon enfant, ne pourrez-vous donc pas trouver dans votre coeur la possibilitť de me pardonner†?';Die Wachen zerren Euren Vater, [From.GetTitledFirstName], aus Eurem Verlies und eskortieren ihn zum Tempel, wo sie die Schlinge um seinen Hals legen. "[Root.GetSonDaughter]", kršchzt er leise und blickt Euch an. "KŲnnt Ihr es nicht in Eurem Herzen finden, mir zu vergeben?";;Los guardias arrastran a tu padre, [From.GetTitledFirstName], desde su mazmorra y le escoltan hasta el templo donde le ponen la soga al cuello. Mi [Root.GetSonDaughter], grazna mientras te mira. ŅNo puedes encontrar en tu corazůn mi perdůn?;;;;;;;;;x
EVTOPTA_TOG_615;No.;Non.;Nein.;;No.;;;;;;;;;x
EVTOPTB_TOG_615;I can't do this to my own father...;Je ne peux pas faire Áa ŗ mon propre pŤre...;Ich kann das meinem eigenen Vater nicht antun...;;No le puedo hacer esto a mi propio padre.;;;;;;;;;x
EVTDESC_TOG_616;Distant screaming can be heard as your guards drag your mother, [From.GetTitledFirstName], from her dungeon. They bring her to the temple and as they place the noose around her neck, she looks at you with pleading eyes. W-why would you do this to your own mother?;On entend des cris lointains alors que des gardes traÓnent votre mŤre, [From.Get_le_TitledFirstName], hors du cachot. Ils la conduisent au temple et lorsqu'ils lui passent la corde au cou, elle vous regarde en sanglotant. 'P-pourquoi faites-vous cela ŗ votre propre mŤre†?';Schon von fern erschallt ihr Wehklagen, als die Wachen Eure Mutter, [From.GetTitledFirstName], aus Eurem Verlies zerren. Sie eskortieren sie zum Tempel, und als sie die Schlinge um ihren Hals legen, blickt sie Euch aus flehenden Augen an. "W-Warum nur tut Ihr dies Eurer eigenen Mutter an?";;Se oyen gritos en la distancia cuando tus guardias arrastran a tu madre, [From.GetTitledFirstName], desde su mazmorra. La traen al templo, y mientras le ponen la soga al cuello, ella te mira con ojos de sķplica. Ņ"Por-por quť le haces esto a tu propia madre?";;;;;;;;;x
EVTOPTA_TOG_616;Because I can.;Parce que je le peux.;Weil ich es kann.;;Porque puedo.;;;;;;;;;x
EVTOPTB_TOG_616;I... I wouldn't...;Je... Je ne veux pas...;Ich... ich kann nicht...;;YoÖ Yo no lo harŪaÖ;;;;;;;;;x
