#CODE;ENGLISH;FRENCH;GERMAN;;SPANISH;;;;;;;;;x
EVTDESC6350;As I was lying in my bed at night I was suddenly woken by the hissing and growling of my favorite cat. The bedchamber was alive with scratching, scurrying noises, coming from the very walls themselves. I sprang from the bed, but the noises suddenly disappeared and a subsquent investigation of the chamber revealed nothing but patched stone walls.;J'ťtais allongť dans mon lit au milieu de la nuit lorsque les grognements et les sifflements de mon chat prťfťrť m'ont rťveillť. La chambre ťtait animťe par le bruit de grattements et de trottinements provenant de l'intťrieur des murs. J'ai bondi hors du lit, mais les bruits se sont tus. Mes recherches subsťquentes n'ont rien rťvťlť de plus que des murs de pierre colmatťs. ;Als ich nachts in meinem Bett lag, erwachte ich von dem Fauchen und Knurren meiner Lieblingskatze. Das Schlafzimmer war erfŁllt von Kratzgeršuschen, die direkt aus den Wšnden zu kommen schienen. Ich sprang aus dem Bett, doch die Geršusche verschwanden abrupt und eine grŁndliche Untersuchung des Raums und der Steinwšnde brachte kein Ergebnis.;;Estaba tumbado en mi cama por la noche cuando de repente me despertů el silbido y gruŮido de mi gato favorito. El dormitorio estaba vivo con ruidos chirriantes provenientes de las mismŪsimas paredes. Saltť de la cama, pero los ruidos desaparecieron de repente y la subsecuente investigaciůn de la habitaciůn no revelů nada mŠs que paredes de piedra con manchas de humedad.;;;;;;;;;x
EVTOPTA6350;Could there be rats in the walls?;Y aurait-il des rats dans le mur†?;KŲnnten sich Ratten in den Wšnden befinden?;;ŅPodrŪa haber ratas en las paredes?;;;;;;;;;x
EVTOPTB6350;Just a dream, nothing more;Rien de plus qu'un rÍve;Nur ein Traum, nichts weiter;;Simplemente un sueŮo, nada mŠs;;;;;;;;;x
EVTDESC6351;The servant I had sent to fetch water never returned and when I went to investigate I noticed a strange light emanating from the well. I peered inside and saw a color like no color I had ever seen before. It was like smoke, cold and wet but burning my skin where it touched.;Le serviteur que j'ai envoyť chercher de l'eau n'est jamais revenu et lorsque je suis allť voir ce qui se passait, j'ai remarquť une ťtrange lueur ťmanant du puits. En regardant ŗ l'intťrieur, j'ai vu une couleur comme jamais je n'en avais vu auparavant. C'ťtait comme de la fumťe, froide et humide. Pourtant elle a brŻlť ma peau au contact.;Der Bedienstete, den ich zum Wasser holen geschickt hatte, kehrte nie zurŁck und als ich nachschauen ging, bemerkte ich einen merkwŁrdigen Lichtschein im Brunnen. Ich wagte einen Blick hinein und sah eine mir gšnzlich unbekannte Farbe, šhnlich wie Rauch, kalt und nass, und dennoch verbrannte sie die Haut bei BerŁhrung.;;El sirviente que habŪa enviado a buscar agua no volvŪa, y cuando fui a investigar notť una extraŮa luz que emanaba del pozo. Echť un vistazo dentro y vi un color como nunca antes habŪa visto. Era como humo, frŪo y hķmedo pero que quemaba mi piel al tocarla.;;;;;;;;;x
EVTOPTA6351;That color is not from this earth!;Cette couleur n'est pas de ce monde†!;Diese Farbe ist nicht von dieser Welt!;;°Ese color no es de esta tierra!;;;;;;;;;x
EVTOPTB6351;The well must have gone bad;L'eau de ce puits doit Ítre pourrie;Das Brunnenwasser muss schlecht geworden sein;;El pozo debe de haberse estropeado;;;;;;;;;x
EVTDESC6352;I had repeatedly questioned my servant about the locked mausoleum beneath the castle but it wasn't until today that I found the key, hidden inside a rotting chest in the oldest castle tower. Inside the tomb's dusty passageways I found an empty stone coffin which bore the inscription '[Root.GetFirstName] [Root.GetOnlyDynastyName]'.;J'avais maintes fois questionnť mon serviteur ŗ propos de ce mausolťe verrouillť situť sous le ch‚teau, mais ce n'est qu'aujourd'hui que j'ai trouvť la clť, cachťe dans un coffre dťsagrťgť qui se trouvait dans la plus vieille tour du ch‚teau. Dans les couloirs poussiťreux du tombeau, j'ai trouvť un cercueil de pierre vide portant l'inscription ę†[Root.GetFirstName] [Root.GetOnlyDynastyName]†Ľ.;Ich fragte meinen Diener wiederholt nach dem verschlossenen Mausoleum unter dem Schloss, doch ich fand erst heute den SchlŁssel in einer verrotteten Truhe im šltesten Schlossturm. In den staubigen Durchgšngen des GewŲlbes fand ich einen leeren Steinsarg mit der Inschrift "[Root.GetFirstName] [Root.GetOnlyDynastyName]".;;HabŪa preguntado repetidamente a mi sirviente acerca del mausoleo cerrado detrŠs del castillo, pero no fue hasta hoy que encontrť la llave, escondida dentro de un baķl podrido en la torre mŠs vieja del castillo. Dentro del polvoriento pasadizo de la tumba encontrť un ataķd de piedra vacŪo con la inscripciůn '[Root.GetFirstName] [Root.GetOnlyDynastyName]'.;;;;;;;;;x
EVTOPTA6352;This coffin looks comfortable to sleep in;Ce cercueil semble propice ŗ un sommeil confortable ;Dieser Sarg sieht komfortabel genug aus, um darin zu schlafen;;Este ataķd parece cůmodo para dormir en ťl.;;;;;;;;;x
EVTOPTB6352;Well, that was morbid... seal the tomb!;C'ťtait morbide, Áa... fermons ce tombeau†!;Wie morbide... versiegelt das GewŲlbe!;;Bien, eso era macabroÖ °Sella la tumba!;;;;;;;;;x
EVTDESC6353;An old cottar and his wife who were known for their cruelty to cats were found dead in their home this morning, their bones picked clean of meat. My steward tells me that the local townspeople had their cats go missing the day before, but all the missing cats returned today looking fat and happy...;Un vieux paysan et sa femme connus pour leur cruautť envers les chats ont ťtť retrouvťs morts ce matin ŗ leur domicile, leurs os complŤtement nettoyťs. Mon intendant me dit que les citadins locaux ont vu leurs chats disparaÓtre la veille, mais qu'ils ont tous resurgi aujourd'hui, heureux et dodus...;Ein alter Farmer und seine Frau, beide bekannt fŁr ihre Grausamkeit gegenŁber Katzen, wurden heute morgen tot in ihrer HŁtte aufgefunden, bis auf die Knochen abgenagt. Laut meinem Haushofmeister verschwanden die Katzen der lokalen BevŲlkerung einen Tag vorher, doch heute kehrten sie alle zurŁck und sahen sehr satt und glŁcklich aus...;;Un viejo granjero y su mujer, conocidos por su crueldad con los gatos, fueron encontrados muertos en su casa esta maŮana sin nada de carne en sus huesos, solamente el esqueleto. Mi asistente dice que los gatos de los habitantes locales habŪan desaparecido el dŪa anterior, pero todos ellos regresaron hoy, gordos y felicesÖ;;;;;;;;;x
EVTOPTA6353;Pass a law banning the killing of cats;Passez une loi pour bannir l'abattage de chats;Verabschiedet ein Gesetz gegen das TŲten von Katzen;;Aprobar una ley que prohŪbe la matanza de los gatos;;;;;;;;;x
EVTOPTB6353;A coincidence, nothing more;Une coÔncidence, tout simplement;Ein Zufall, mehr nicht;;Una coincidencia, nada mŠs;;;;;;;;;x
EVTTOOLTIP6354;Somewhere, a dreamer stirs...;Quelque part, un rÍveur s'agite...;Und irgendwo regt sich ein Tršumer im Schlaf...;;En algķn lugar, un soŮador despiertaÖ;;;;;;;;;x
EVTDESC6354;Since the incident some weeks ago I have felt uneasy. I took a walk along the coast to clear my mind and found a small village where the people claimed to worship the 'Old Ones', Gods older than even those of the [Root.Religion.GetName] faith. They invited me to join in their rituals and showed me a dusty old grimoire written by a mad Saracen.;Depuis l'incident survenu il y a quelques semaines, je ne me sens pas trŤs ŗ l'aise. J'ai marchť le long de la cŰte pour me changer les idťes et j'ai trouvť un petit village oý les gens disent vťnťrer les 'Anciens', des dieux plus vieux encore que ceux qui pratiquent le [Root.Religion.GetName]. Ils m'ont invitť ŗ me joindre ŗ leurs rituels et m'ont montrť un vieux grimoire poussiťreux ťcrit par un sarrasin fou. ;Seit dem Vorfall vor einigen Wochen bin ich unruhig. Ich machte einen Spaziergang an der KŁste entlang, um mich auf andere Gedanken zu bringen und fand ein kleines Dorf, in dem die Bewohner den "GroŖen Alten" verehrten. Sie luden mich zu ihren Ritualen ein und zeigten mir ein staubiges, altes Buch, das von einem wahnsinnigen Sarazenen geschrieben worden ist.;;Desde el incidente de hace unas semanas me siento intranquilo. DŪ un paseo a lo largo de la costa para aclarar mi mente y encontrť un pequeŮo pueblo donde las personas afirmaban adorar a los ĎAncianosí, dioses mŠs viejos aķn que los de la fe [Root.Religion.GetName]. Me invitaron a unirme a sus rituales y me enseŮaron un grimorio viejo y empolvado, escrito por un sarraceno loco.;;;;;;;;;x
EVTOPTA6354;I must study this grimoire;Je dois ťtudier ce grimoire ;Ich sollte dieses Zauberbuch studieren;;Debo estudiar este grimorio;;;;;;;;;x
EVTTOOLTIP6355;[Root.GetBestName] learns the forbidden secrets;[Root.Get_only_Le_Title][Root.GetBestName] apprend les secrets interdits;[Root.GetBestName] lernt die verbotenen Geheimnisse;;[Root.GetBestName] aprende los secretos prohibidos;;;;;;;;;x
EVTDESC6355;Intense study of the grimoire has gained me much knowledge. I have devised a ritual to awaken the most powerful of the Old Ones where he sleeps, dead but dreaming, in his watery tomb beneath the ocean. The cult has prepared the ritual attire and is gathering the necessary sacrifices.;J'ai acquis de prťcieuses connaissances gr‚ce ŗ l'ťtude approfondie de ce grimoire. J'ai ťlaborť un rituel destinť ŗ rťveiller le plus puissant des Grands Anciens lŗ oý il sommeille, mort mais plongť dans un rÍve, dans son tombeau sous l'ocťan. Les adeptes du culte ont prťparť les tenues pour le rituel et ils effectuent les sacrifices requis.;Durch intensive Studien des Zauberbuchs erlangte ich neues Wissen. Ich entwickelte ein Ritual, um den mšchtigsten der GroŖen Alten aus seinem Schlummer, tot aber tršumend, tief in seinem nassen Ozeangrab zu erwecken. Der Kult hat das Ritual vorbereitet und sammelt die notwendigen Opfergaben.;;He ganado mucho conocimiento con el intenso estudio del grimorio. He trazado un ritual para despertar al mŠs poderoso de los Ancianos de donde duerme, muerto pero soŮando, en su tumba acuosa bajo el ocťano. El culto ha preparado el atuendo para el ritual y estŠn reuniendo los sacrificios necesarios.;;;;;;;;;x
EVTOPTA6355;Tonight, he will wake!;Ce soir, il se rťveillera†! ;Heute Nacht wird er erwachen!;;Esta noche, °ťl despertarŠ!;;;;;;;;;x
EVTTOOLTIP6356;[Root.GetBestName] puts on a black robe and wizened old hat;[Root.Get_only_Le_Title][Root.GetBestName] enfile une robe noire et se coiffe d'un chapeau rabougri;[Root.GetBestName] zieht eine schwarze Robe und einen schrumpeligen, alten Hut an;;[Root.GetBestName] se pone una toga negra y un viejo sombrero arrugado;;;;;;;;;x
EVTDESC6356;The cult has gathered for the ritual on the shore of a black and stormy sea. The chanting begins, Ph'nglui mglw'nafh..., and in the depths of the dark waters something stirs...;Les adeptes du culte sont rassemblťs pour le rituel sur la rive d'une mer tťnťbreuse et orageuse. Le chant commence ę†Ph'nglui mglw'nafh...†Ľ et quelque chose s'agite dans les profondeurs des eaux sombres.;Der Kult hat sich fŁr das Ritual an der KŁste einer stŁrmischen, schwarzen See versammelt. Die Gesšnge beginnen, Ph"nglui mglw"nafh ..., und in den Tiefen des schwarzen Gewšssers rŁhrt sich etwas ...;;El culto se ha reunido para el ritual a la orilla de un negro y tormentoso mar. Los cŠnticos empiezan, Ph'nglui mglw'nafh..., y en las profundidades de las oscuras aguas algo se mueveÖ;;;;;;;;;x
EVTOPTA6356;He comes! HE COMES!;Le voilŗ†! LE VOILņ†!;Er kommt! ER KOMMT!;;°…l viene! °…L VIENE!;;;;;;;;;x
EVTOPTB6356;What have I done?! I must stop this!;Qu'ai-je fait†?! Je dois mettre fin ŗ tout Áa†! ;Was habe ich getan? Ich muss es aufhalten!;;°ŅQuť es lo que he hecho?! °Debo pararlo!;;;;;;;;;x
EVTTOOLTIP6357;[Root.GetBestName] commandeers a longboat;[Root.Get_only_Le_Title][Root.GetBestName] rťquisitionne une chaloupe;[Root.GetBestName] kommandiert ein groŖes Beiboot;;[Root.GetBestName] incauta una galera;;;;;;;;;x
EVTDESC6357;I steered the longboat through the raging waters towards the monstrous creature. It stood as tall as a castle tower, with the body of a man and the head of a great tentacled beast. I knew that I had awoken it from where it slept beneath the waves and that it was here to end the age of man. There was only one thing I could do...;J'ai dirigť la chaloupe dans les eaux enragťes vers la crťature monstrueuse. Elle se tenait debout, aussi haute que la tour d'un ch‚teau, avec un corps d'homme et une tÍte garnie de tentacules. Je savais que je l'avais sortie de son sommeil abyssal et qu'elle ťtait venue pour mettre fin au rŤgne de l'homme. Il ne me restait qu'une chose ŗ faire...;Ich steuerte das groŖe Beiboot durch die tosenden Gewšsser in Richtung der monstrŲsen Kreatur. Sie war so groŖ wie ein Schlossturm, mit dem KŲrper eines Mannes und dem Kopf eines gigantischen Biests mit Tentakeln. Ich wusste, dass ich es aus seinem Schlummer erweckt hatte und dass es das Ende des Menschenzeitalters bringen wŁrde. Ich konnte nur noch eines tun...;;DirigŪ la galera a travťs de las aguas embravecidas hacia la criatura monstruosa. Se alzů alta como la torre de un castillo, con el cuerpo de un hombre y la cabeza de una gran bestia con tentŠculos. Supe que la habŪa despertado de donde dormŪa bajo las olas, y que estaba aquŪ para acabar con la edad del hombre. Sůlo habŪa una cosa que yo pudiera hacerÖ;;;;;;;;;x
EVTOPTA6357;Ramming speed!;Vitesse maximale†!;Rammgeschwindigkeit!;;°Velocidad de ariete!;;;;;;;;;x
EVTTOOLTIP6358;A fateful collision...;Une collision fatidique...;Eine schicksalshafte Kollision...;;Una fatŪdica colisiůnÖ;;;;;;;;;x
EVTDESC6358;I awoke in my own bed weak and sweating. The servants told me that they had found me on the shore, naked and half-drowned. I asked them about the creature and the ship but they just looked at me with worried eyes and shook their heads. It seems I am the only living witness to these events.;Je me suis rťveillť dans mon lit, faible et tout en sueur. Les serviteurs m'ont dit m'avoir trouvť sur le rivage, nu et ŗ demi noyť. Je leur ai posť des questions au sujet de la crťature et du vaisseau, mais ils m'ont fixť avec des yeux inquiets puis ils ont secouť la tÍte. Je serais donc le seul et dernier tťmoin vivant de ces ťvťnements.;Ich erwachte schwach und schweiŖgebadet in meinem eigenen Bett. Die Diener erzšhlten, dass sie mich nackt und halbertrunken am Strand gefunden hatten. Ich berichtete ihnen von der Kreatur und dem Schiff, doch sie schauten mich nur besorgt und kopfschŁttelnd an. Scheinbar bin ich der einzig lebende Zeuge dieser Ereignisse.;;Me despertť en mi cama dťbil y sudando. Los sirvientes me dijeron que me habŪan encontrado en la orilla, desnudo y medio ahogado. Les preguntť por la criatura y el barco pero simplemente me miraron con ojos preocupados y sacudieron la cabeza. Parece ser que soy el ķnico testigo viviente de esos acontecimientos.;;;;;;;;;x
EVTOPTA6358;I must put them to print;Je dois faire imprimer cela;Ich muss sie niederschreiben;;Debo ponerlos a imprimir;;;;;;;;;x
EVTOPTB6358;Fools! I saved you all!;Imbťciles†! Je vous ai tous sauvťs†!;Narren! Ich habe euch alle gerettet!;;°Necios! °Os he salvado a todos!;;;;;;;;;x
LOWER_RELATIVE_POWER;Army is less than ßY$VAL$%ßW of ßY$OTHER$ßW.;L'armťe est ßY$VAL$%ßW plus petite que ßY$OTHER$ßW.;Armee geringer als ßY$VAL$%ßW von ßY$OTHER$ßW.;;El ejťrcito es menos que ßY$VAL$%ßW de ßY$OTHER$ßW.;;;;;;;;;x
HIGHER_RELATIVE_POWER;Army is at least ßY$VAL$%ßW of ßY$OTHER$ßW.;L'armťe est au moins ßY$VAL$%ßW de ßY$OTHER$ßW.;Armee mindestens ßY$VAL$%ßW von ßY$OTHER$ßW.;;El ejťrcito es al menos ßY$VAL$%ßW de ßY$OTHER$ßW.;;;;;;;;;x
TRIBAL_TITLE_DESTROYED_SETUP;Tribal Title Abandoned;Titre tribal abandonnť;Stammes-Titel aufgegeben;;TŪtulo Tribal Abandonado;;;;;;;;;x
TRIBAL_TITLE_DESTROYED_LOG;The formal title 'ßY$TITLE$ß!' has been abandoned.;Le titre officiel 'ßY$TITLE$ß!' a ťtť abandonnť.;Der formale Titel "ßY$TITLE$ß!" wurde aufgegeben.;;El tŪtulo formal 'ßY$TITLE$ß!' ha sido abandonado.;;;;;;;;;x
TRIBAL_TITLE_DESTROYED_LETTER;There is no reason to formally use the title 'ßY$TITLE$ß!' anymore - it sounds primitive and shall henceforth be abandoned.;Il n'y a plus aucune raison d'utiliser le titre 'ßY$TITLE$ß!' qui paraÓt primitif. On devra dťsormais l'abandonner. ;Es gibt keinen Grund, den Titel "ßY$TITLE$ß!" weiterhin formell zu verwenden Ė er klingt primitiv und soll in Zukunft nicht verwendet werden.;;Ya no hay razůn para utilizar el tŪtulo 'ßY$TITLE$ß!' formalmente suena primitivo y deberŪa ser abandonado a partir de ahora.;;;;;;;;;x
killed_an_old_one;Godslayer;Dťicide;Gottesvernichter;;Matadioses;;;;;;;;;x
alert_can_reform_religion_name;ßYReligion can be Reformedß!;ßYLa religion peut Ítre rťformťeß!;ßYReligion kann reformiert werdenß!;;ßYLa Religiůn puede ser Reformadaß!;;;;;;;;;x
alert_can_reform_religion_instant;ßYReligion can be Reformedß!;ßYLa religion peut Ítre rťformťeß!;ßYReligion kann reformiert werdenß!;;ßYLa Religiůn puede ser Reformadaß!;;;;;;;;;x
alert_can_reform_religion_delayed;The ßY$RELIGION$ß! faith can be reformed into an organized religion;La foi ßY$RELIGION$ß! peut Ítre rťformťe en une religion organisťe;Der ßY$RELIGION$ß!e-Glauben kann in eine organisierte Religion reformiert werden;;La fe ßY$RELIGION$ß! puede ser reformada a una religiůn organizada;;;;;;;;;x
HOLYSITE_CONTROL_OURS;The Holy Site of ßY$SITENAME$ß! is completely under the control of ßY$RELIGION$ß!;Le lieu saint de ßY$SITENAME$ß! est entiŤrement sous contrŰle de ßY$RELIGION$ß!;Die Heilige Stštte ßY$SITENAME$ß! wird vom ßY$RELIGION$enß!-Glauben vollstšndig kontrolliert;;El Sitio Sagrado de ßY$SITENAME$ß! estŠ completamente bajo el control de ßY$RELIGION$ß!;;;;;;;;;x
HOLYSITE_CONTROL_PARTIAL;The Holy Site of ßY$SITENAME$ß! is held by a member of ßY$RELIGION$ß!, but is a vassal of another religion;Le lieu saint de ßY$SITENAME$ß! est tenu par un fidŤle de ßY$RELIGION$ß!, mais celui-ci est vassal d'un souverain d'une autre religion;Die Heilige Stštte ßY$SITENAME$ß! wird durch ein Mitglied des ßY$RELIGION$enß! Glaubens gehalten, welches aber Vasall einer anderen Religion ist;;El Sitio Sagrado de ßY$SITENAME$ß! estŠ tomado por un miembro de ßY$RELIGION$ß!, pero es un vasallo de otra religiůn;;;;;;;;;x
HOLYSITE_CONTROL_NOT;The Holy Site of ßY$SITENAME$ß! is not held by a member of ßY$RELIGION$ß!;Le lieu saint de ßY$SITENAME$ß! n'est pas occupť par un fidŤle de ßY$RELIGION$ß!;Die Heilige Stštte ßY$SITENAME$ß! wird nicht durch ein Mitglied des ßY$RELIGION$enß! Glaubens gehalten;;El Sitio Sagrado de ßY$SITENAME$ß! no estŠ tomado por un miembro de ßY$RELIGION$ß!;;;;;;;;;x
HOLYSITE_LOCATION;The Holy Site of ßY$SITENAME$ß! is located in the county of ßY$COUNTY$ß!;Le lieu saint de ßY$SITENAME$ß! se situe dans le comtť de ßY$COUNTY$ß!;Die Heilige Stštte von ßY$SITENAME$ß! befindet sich in der Grafschaft von ßY$COUNTY$ß!;;El Sitio Sagrado de ßY$SITENAME$ß! se encuentra en el condado de ßY$COUNTY$ß!;;;;;;;;;x
INTERACTION_REQUIRES_NO_LOOTING_HOSTILITY;We cannot declare war on ßY[Recipient.GetTitledFirstName]ß! while we are raiding them;Nous ne pouvons pas dťclarer la guerre [Recipient.Get_au_TitledFirstNameJ] pendant que nous les attaquons;Wir kŲnnen ßY[Recipient.GetTitledFirstName]ß! nicht den Krieg erklšren, wšhrend wir sie Łberfallen;;No podemos declarar la guerra a ßY[Recipient.GetTitledFirstName]ß! mientras les estamos atacando;;;;;;;;;x
FROM_ATTRIBUTES;From Attributes: ßG+$AMOUNT$ß!;Gr‚ce aux compťtences†: ßG+$AMOUNT$ß!;Durch Fšhigkeiten: ßG+$AMOUNT$ß!;;De atributos: ßG+$AMOUNT$ß!;;;;;;;;;x
HOLY_SITES_LESS;Does NOT control at least ßY$VAL$ßW holy sites\n;Ne contrŰle pas au moins ßY$VAL$ßW lieux saints\n;Kontrolliert NICHT mindestens ßY$VAL$ßW heilige Stštten\n;;NO controla al menos ßY$VAL$ßW sitios sagrados\n;;;;;;;;;x
HOLY_SITES_LEAST;Controls at least ßY$VAL$ßW holy sites\n;ContrŰle au moins ßY$VAL$ßW lieux saints\n;Kontrolliert mindestens ßY$VAL$ßW heilige Stštten\n;;Controla al menos ßY$VAL$ßW sitios sagrados\n;;;;;;;;;x
MAJOR_RIVER_SHORT;Crossing of the Major River ßY$RIVER$ß! to ßY$TO$ß!;Traversťe du fleuve majeur ßY$RIVER$ß! vers ßY$TO$ß!;‹berquerung des Hauptflusses ßY$RIVER$ß! nach ßY$TO$ß!;;Atravesando el Gran RŪo ßY$RIVER$ß! a ßY$TO$ß!;;;;;;;;;x
MAJOR_RIVER_DESC;When attacking over a Major River, the attacking army will get a significant combat penalty;Une armťe qui attaque depuis un fleuve majeur reÁoit d'importantes pťnalitťs au combat.;Wenn der Angriff Łber einen groŖen Fluss erfolgt, so erleidet die angreifende Armee einen signifikanten Kampf-Malus;;Cuando se ataca cruzando un Gran RŪo, el ejťrcito atacante recibirŠ una sanciůn significativa de combate;;;;;;;;;x
RETCAP_FROM_REALM;From Realm: ßG$REALM$ß!\n   Holdings: ßY$HOLDINGS$ß!\n   Cap per Holding: ßY$PERHOLDING$ß!\n;Gr‚ce au domaine et aux vassaux†: ßG$REALM$ß!\n  Propriťtťs†: ßY$HOLDINGS$ß!\n  Par propriťtť†: ßY$PERHOLDING$ß!\n;Durch Reich: ßG$REALM$ß!\n  Durch BesitztŁmer: ßY$HOLDINGS$ß!\n   Limit pro Besitztum: ßY$PERHOLDING$ß!\n;;De Reino: ßG$REALM$ß!\n   Propiedades: ßY$HOLDINGS$ß!\n   Nķmero mŠximo de personas por Propiedad: ßY$PERHOLDING$ß!\n;;;;;;;;;x
RETCAP_FROM_BUILDINGS;From Buildings: ßG$AMOUNT$ß!\n;Gr‚ce aux b‚timents†: ßG$AMOUNT$ß!\n;Durch Gebšude: ßG$AMOUNT$ß!\n;;De Edificios: ßG$AMOUNT$ß!\n;;;;;;;;;x
RETCAP_FROM_TECH;From Technology: ßG+$PERCENT$%ß!\n;Gr‚ce ŗ la technologie†: ßG+$PERCENT$%ß!\n;Durch Technologie: ßG+$PERCENT$%ß!\n;;De TecnologŪa: ßG+$PERCENT$%ß!\n;;;;;;;;;x
RETCAP_MINIMUM_RETINUE;Minimum Retinue: ßY$MIN$ß!\n;Escorte minimale†: ßY$MIN$ß!\n;Mindestgefolge: ßY$MIN$ß!\n;;Sťquito mŪnimo: ßY$MIN$ß!\n;;;;;;;;;x
RETCAP_FROM_RELIGION;From Religion: $AMOUNT$\n;Gr‚ce ŗ la religion†: $AMOUNT$\n;Durch Religion: $AMOUNT$\n;;De Religiůn: $AMOUNT$\n;;;;;;;;;x
RETCAP_TOTAL;\nTotal: ßY$TOTAL$ß!;\nTotal†: ßY$TOTAL$ß!;\nGesamt: ßY$TOTAL$ß!;;\nTotal: ßY$TOTAL$ß!;;;;;;;;;x
RAISE_COUNTY_LEVIES;Raise County Levies;Lever les troupes du comtť;Graftschafts-Aufgebote ausheben;;Aumentar Reclutamientos en el Condado;;;;;;;;;x
RAISE_COUNTY_FLEETS;Raise County Fleets;Lever les flottes du comtť;Grafschafts-Flotten zusammenziehen;;Aumentar Flota del Condado;;;;;;;;;x
TECH_DEM_INC_EMPERORS;ßG+$AMOUNT$ß! Demesne size for Emperors;Taille du domaine des empereurs ßG+$AMOUNT$ß!;ßG+$AMOUNT$ß! HerrschaftsgebietsgrŲŖe fŁr Kaiser;;ßG+$AMOUNT$ß! TamaŮo de dominio para Emperadores;;;;;;;;;x
TECH_DEM_INC_KINGS;ßG+$AMOUNT$ß! Demesne size for Kings;Taille du domaine des rois ßG+$AMOUNT$ß!;ßG+$AMOUNT$ß! HerrschaftsgebietsgrŲŖe fŁr KŲnige;;ßG+$AMOUNT$ß! TamaŮo de dominio para Reyes;;;;;;;;;x
TECH_DEM_INC_DUKES;ßG+$AMOUNT$ß! Demesne size for Dukes;Taille du domaine des ducs ßG+$AMOUNT$ß!;ßG+$AMOUNT$ß! HerrschaftsgebietsgrŲŖe fŁr HerzŲge;;ßG+$AMOUNT$ß! TamaŮo de dominio para Duques;;;;;;;;;x
TECH_DEM_INC_COUNTS;ßG+$AMOUNT$ß! Demesne size for Counts;Taille du domaine des comtes ßG+$AMOUNT$ß!;ßG+$AMOUNT$ß! HerrschaftsgebietsgrŲŖe fŁr Grafen;;ßG+$AMOUNT$ß! TamaŮo de dominio para Condes;;;;;;;;;x
TECH_DEM_INC_BARONS;ßG+$AMOUNT$ß! Demesne size for Barons;Taille du domaine des barons ßG+$AMOUNT$ß!;ßG+$AMOUNT$ß! HerrschaftsgebietsgrŲŖe fŁr Barone;;ßG+$AMOUNT$ß! TamaŮo de dominio para Barones;;;;;;;;;x
HINT_TECH_VIEW_TEXT_2;All Rulers above the rank of Count accumulate Technology Points in each of the three groups based on their Attributes.\nThese points can then be spent to increase the technological level in their capital.\nTechnology can also spread to neighbouring provinces, between demesne provinces or in Trade Zones.;Tous les seigneurs au-delŗ du titre de comte accumulent des points de technologie dans chacun des trois groupes en fonction de leurs compťtences. Ces points servent ŗ amťliorer le niveau technologique de la capitale. La technologie peut aussi s'ťtendre aux provinces voisines, d'une province ŗ l'autre au sein d'un mÍme domaine, ou dans les zones marchandes.;Herrscher ab dem Rang Graf sammeln Technologiepunkte in allen drei Gruppen, basierend auf ihren Werten. Diese Punkte kŲnnen zur ErhŲhung der Technologiestufe in ihrer Hauptstadt verwendet werden. Die Technologie kann sich auf benachbarte Provinzen, Herrschaftsprovinzen oder in Handelszonen ausbreiten.;;Todo gobernante por encima del rango conde acumula Puntos de tecnologŪa en cada uno de los tres grupos, segķn sus atributos.\nEstos se pueden gastar en aumentar el nivel tecnolůgico de su capital.\nLa tecnologŪa tambiťn puede extenderse a provincias vecinas, entre las de heredad o en zonas comerciales.;;;;;;;;;x
UNDER_PLAYER;This Holy Site is under your control;Vous avez le contrŰle de ce lieu saint;Diese Heilige Stštte befindet sich unter Eurer Kontrolle;;Este Sitio Sagrado estŠ bajo tu control;;;;;;;;;x
RELIGION_UNIT_MODIFIER;Modifier to all Units and Holdings controlled by this religion:;Modificateur appliquť ŗ toutes les unitťs et propriťtťs contrŰlťes par cette religion†: ;Modifikator fŁr alle Einheiten und BesitztŁmer unter der Kontrolle dieser Religion:;;Modificador a todas las Unidades y Provincias controlado por esta religiůn:;;;;;;;;;x
